{
  "proof_id": "joy_bringer_005",
  "badge_id": "joy_bringer",
  "type": "trusted_witness",
  "submitted_by": "jaywisdom",
  "timestamp": "2026-05-31T21:05:00Z",
  "content": "Validation #26 proof instance 005 for joy_bringer: production-scale batch artifact generated for schema validation.",
  "privacy": "family-only",
  "authority": false
}
